<?xml version="1.0"?>
<!DOCTYPE Aircraft SYSTEM "../aircraft.dtd">
<Aircraft>
  <Callsign>CJR</Callsign>
  <Full_Callsign>VH-CJR</Full_Callsign>
  <Type>PA28</Type>
  <Approved_Type/>
  <Colour>Red/White</Colour>
  <Description>Piper Archer</Description>
  <Equipment>
    <VHF/>
    <SSR>Mode_C</SSR>
  </Equipment>
  <Wake>Light</Wake>
  <Fuel_Consumption>
    <Climb>36</Climb>
    <Cruise>36</Cruise>
    <Descend>36</Descend>
    <Holding>36</Holding>
    <Taxi>36</Taxi>
    <AWK>36</AWK>
  </Fuel_Consumption>
  <Air_Speed>
    <Climb>110</Climb>
    <Cruise>110</Cruise>
    <Descend>110</Descend>
  </Air_Speed>
  <Limits>
    <MTOW>1156</MTOW>
    <MLW>1156</MLW>
    <MZFW>1156</MZFW>
  </Limits>
  <Loading>
    <Seat>
      <Description>Front Row</Description>
      <Arm>2044.7</Arm>
      <Type>Always_A_Seat</Type>
      <Maximum>100</Maximum>
    </Seat>
    <Seat>
      <Description>Front Row</Description>
      <Arm>2044.7</Arm>
      <Type>Always_A_Seat</Type>
      <Maximum>100</Maximum>
    </Seat>
    <Seat>
      <Description>Back Row</Description>
      <Arm>2999.7</Arm>
      <Type>Always_A_Seat</Type>
      <Maximum>100</Maximum>
    </Seat>
    <Seat>
      <Description>Back Row</Description>
      <Arm>2999.7</Arm>
      <Type>Always_A_Seat</Type>
      <Maximum>100</Maximum>
    </Seat>
    <Seat>
      <Description>Baggage</Description>
      <Arm>3627.1</Arm>
      <Type>Not_A_Seat</Type>
      <Maximum>91</Maximum>
    </Seat>
    <Fuel_Tank>
      <Description>Main Fuel Tanks</Description>
      <Arm>2413.0</Arm>
      <Maximum>181</Maximum>
    </Fuel_Tank>
  </Loading>
  <COG>
    <Entry>
      <Arm>2080</Arm>
      <Weight>600</Weight>
    </Entry>
    <Entry>
      <Arm>2080</Arm>
      <Weight>900</Weight>
    </Entry>
    <Entry>
      <Arm>2250</Arm>
      <Weight>1156</Weight>
    </Entry>
    <Entry>
      <Arm>2370</Arm>
      <Weight>1156</Weight>
    </Entry>
    <Entry>
      <Arm>2370</Arm>
      <Weight>600</Weight>
    </Entry>
  </COG>
  <Basic_Empty_Weight>676</Basic_Empty_Weight>
  <Arm>2218</Arm>
</Aircraft>
